{"apiVersion":"sentinel-api-0.1.0","artifactSchema":"sentinel.verdict.canonical.v1","confidence":84,"evaluatedAt":1782916498,"mode":"trade_execution","models":{"primary":"serv-nano","secondary":"serv-swift"},"objections":["step_0: Direction claim verified against market data."],"reasoning":"All steps adequately supported by the evidence.","tier":"standard","verdict":"ALLOW","verificationId":"sent_9f3c2a7b1e004d68"}